,0
0,"Outstanding hotel. Best place I have ever stayed. My 2nd time staying at this hotel. Staff and courteous and helpful. Rooms are luxurious. Food is excellent, atmosphere classy and playful."
1,"hotel is excellent throughout.  position is great.
Our room was fantastic-it was an upgrade as we were celebrating our 20th wedding anniversary"
2,"Room service is delicious!  Thanks, Louis for you care in setting up our breakfast. Beautiful room with fantastic view of the strip."
3,"It's a luxorious yet very interesting hotel. The details and the amount of amenities is astonishing. The rooms are big and the bathrooms are enormous. My room had an astonishing view to the mountains, overlooking the city lights, Treasure Island, The Mirage and if you go closer and see left you see more of the strip, with an entire wall as a window."
4,"Service, comfort staff, shows excellent, expected no less from the Wynn."
5,"My first time staying at a 5 star hotel. I don't think I want to go back to any other kind. The staff was super polite; everything worked and was made possible (for example, I was able to store my luggage at the property after check out, as my flight left later on). Life in a 5 star hotel is just that much more beautiful. And I think Wynn and Encore are exceptionally beautiful! I wish I could've stayed longer."
6,"This is the Wynn, the mighty Wynn. They set the benchmark for what a hotel can be. If the devil is in the detail, Wynn is where all devils work to make a hotel. (Pun intended, this is Vegas after all). Every small detail is taken cared of and executed well. It was a pleasure to be back in Wynn again."
7,"Great facilities . Property is impressive , clean . Casino is nice."
8,Nothing stands out.
9,"I cannot really complain about the Wynn as the hotel is a classic luxury hotel, the beds were comfortable, the view out of the window was great, the staff were pleasant and helpful and efficient. However it was all a bit meh.... There is nothing spectacular or quirky or very interesting about the place. It is just a straightforward, very expensive, luxury hotel with zero character. On previous trips to Las Vegas I have stayed in other hotels - the Bellagio and the Venetian and I prefer the Venetian by far as it has a bit more character and interest (the canals). The Bellagio has the fabulous fountains and great floral arrangements in the public areas. I would recommend those two hotels over the Wynn if you are going to spend that kind of money.  Also you do not need to book the panoramic rooms as the views from the  less expensive rooms  are just as good if not better. The rooms that overlook the golf course have a better view."
10,Overall it was wonderful as I had remember 7 years ago when I came in. One thing I would like to point out I totally had nothing to talk about but thumbs up for Wynn. Thus l was a little shock when there was no bath room slippers. You will need to call to request for it and I think they might not be able to offer it to you if they don have it. For the standard they were. I guess I would have to said they did drop.
11,I left my card purse on a machine and walked off - I realized five minutes later - I inquired and security had already taken it to list and found - spectacular - security - most important of all we are safe here and staff are all happy to do their job
12,"Location, Room and the views"
13,Very nice architecture and decoration. Le reve show was stunning and breathtaking.
14,The scenic view from floor to ceiling windows. The furnishings and Christmas decorations. The electronic controls in the room.
15,"Excelent location in the center of the cíty. A super wiew fron your room to all the city.
A realy luxury  hotel,good rates /value."
16,Rooms were large and comfortable- very well appointed and great for working on a business trip. Could easily entertain in the room.
17,Extremely modern and clean. Employees extremely friendly
18,This property is so well designed and supremely managed. This is the number one hotel and casino in LV. The others are relatively tacky and poorly run. Well done Wynns and thank you for a superb stay.
19,Beds were awesome. Room was palatial. Views of Las Vegas were great. Pool was great with plenty of room and poolside service.  Loved this hotel.
20,Service was exceptional. Staff was friendly. Food was great.
21,"Cleanliness, politeness and professionalism of staff, quality and selection of restaurants, fitness facility, and attention to detail."
22,"the room was very well maintained by really friendly team of staff. Easy to ask for whatever you wanted and plenty of staff to ask.
The restaurants offered a good selection"
23,"Huge comfortable bed, amazing views, and the bath was fabulous. Lovely helpful staff, especially concierges. Great places to eat."
24,THE PLACE HAS THOUGHT OF EVERYTHING
25,"Amazing Hotel overall. From staffs, facility, rooms and the restaurants. Even though we don't gamble that much but the casino is beautiful and clean. They're staffs are very accommodating and friendly. The room we got with a fantastic view facing the golf course and it's pretty clean. We, love the buffet especially for breakfast. Also the decorations in this hotel is beautiful. We definitely would love to go back."
26,The eggs and the toast were cold and there was no butter or forks on the tray
27,Magnificent hotel that provided a memorable stay. Everything was 5 star luxury and the hotel was in perfect condition. Swimming pool was wonderful and the brunch buffet was amazing.
28,"- Room and bathroom is very big.
- Concierge working very good.
- One of the best spa i have ever visited.
- ""The Buffet"" restaurant is the greatest open buffet restaurant of the world.
- Top quality casino with helpful and friendly staff."
29,Beautiful hotel. Restaurant were great.
30,The best value hotel in Vegas. For people who like to go all out but are not rich! It has some restaurants which are great other not so much. We liked the Red 8 and we love 'La Cave' which offers great wine tasting along with gurment tapas.
31,"location, pool, our room was very comfy and bathroom was wonderful"
32,"Fantastic hotel, in our opinion the best on the Strip! Hotel facilities and room were great. Staff friendly and helpful. Pool and pool area a brilliant. 'Le Reve' a must see..."
33,"Many amenities like clubs, cafes, restaurants etc. Within easy walking distance of everything we needed."
34,"The best hotel in Vegas. We were able to visit quite a few hotels during our stay and didn't see anything anywhere near as nice as the Wynn. The Encore, which is the sister hotel looked lovely, but the Wynn was classier in its appearance in my opinion."
35,Room had great view of the golf course and was very spacious and very modern
36,welcome at the front door sets the tone .front desk staff pleasant.  rooms are very nice and clean beds are very comfortable . the staff at the terrace pointe cafe are very accommodating great breakfast with bar they can make a great ramos fizz.
37,"- Large rooms with nice bathroom
- Friendly staff
- Nice pool area with great customer service
- Great brunch"
38,Room was amazing with the view. Gym was also very good
39,"The Buffet was amazing, the beds were very comfortable! Location was good."
40,"Decor, flower displays, attention to detail. Nightlife options, amazingly helpful staff"
41,Best place to stay in Vegas. Everything that you need is there. Big room and bathroom. Clean and comfy. Staffs are helpful and facilities are great. Casino is nice too.
42,"Very nice hotel. The view was unbelievable. The swimming pool was great. The restaurants were excellent. The room was very nice, truly enjoyable. One of the best ones in Vegas."
43,"Wynn Resort & Casino was an excellent choice, great restaurants, upscale and classy atmosphere. 
The interior is outstanding, many details to appreciate and contemplate at.
Le Reve show at the hotel is a must see.
Designers clothing like Chanel, Dior, LV etc... range of price is similar to the international market and not exaggerated or overrated."
44,Location is good because it has the theater for the show I reserved
45,"The whole hotel has more of an upper class about its self, than other hotels I have stayed in Las Vegas.The bars,restaurants and the casino the staff where fantastic I could not have been happier with the whole stay.
Asked for a heigh room and the views where amazing."
46,"Amazing pool!! Beautiful hotel!! Le Reve show amazing right in the hotel!! The food was fantastic! I LOVED the cafe coffee shop
Every morning with pastries! The bathroom was huge, shower and I would stay at this property again absolutely!!"
47,The lobby area and bar at the water falls.
48,Facilities were nice
49,Nice room with great views. Very comfy bed. Good location on the better end of the strip.
50,Stunning view of the strip!!! Hotel Design is whimsical as if we were in a fairytale!!!!! Best night clubs in town too
51,"Beautiful luxurious hotel, amazing lobby, wide variety of restaurants, Casino, very big but still well maintained, easy accessible regardless its size"
52,Cleanliness of the room and at every area of the hotel. Good facilities / amenities.
53,"Beautiful property, great restaurants"
54,"Great hotel directly on the strip, spacious and modern rooms, everything was clean and modern unlike other Vegas hotes"
55,"The hotel was nice, pool water temperature perfect. Checkout, hassle free"
56,Once we paid for an upgrade the room was lovely other then that we were looking over air conditioning vents of the hotel!
57,"All the hotel departments were excellent. They had a nanny arranged for us (who was amazing), helped us installed the baby monitor. 
I forgot my dress in the room and was almost about to leave. I called them and someone personally rushed up and got it for me in like 10 mins. Amazing experience!"
58,"Laxury & spacious rooms, enchanting design of hotel lobby"
59,Amazing experience!! From the check in to the rooms to the casino and shops. Wouldn't stay anywhere else!!
60,"Very large room, with great views down the strip"
61,"It looks like a 5-star hotel should and has fantastic facilities - casino, restaurants, pool, bars"
62,"Huge room with great view (we took the panaramic suite located level 54). 
Very confortable, AC works well (silent, proper location). Nice decoration, very clean. Impressive pool. Many great restaurants, shops, ... in the resort - easy to avoid LV summer heat.
We enjoyed our stay.. especially after 2 weeks of camping."
63,Buffet brilliant. Room lovely.
64,Property was great. Room was clean. Food was great. Staff at XS.was beyond terrible.
65,I liked our room we paid extra money for the upgrade but it was worth it.
66,The most comfortable bed ever! Staff was amazing and friendly
67,The room was very comfortable very clean the bathroom is perfect and the facilities are wonderful
68,"What an amazing experience. We had booked 2 double rooms, but upon check in were informed that we had been upgraded to an Encore fairway Villa.  Words cannot express how great the room was.  We all had a great time in Vegas.
THANKS WYNN"
69,The Wynn is a beautiful hotel and has great rooms that are understated-not your typical Vegas room.
70,"The decor of the hotel was amazingly beautiful and the room was enormous, decorated beautifully and very clean, the spa was top notch, restaurant delicious"
71,"The staff were horrible. Wait staff at all restaurants (tried to get
coffee at one restaurant and said he did not want to make it and sent us
to the coffee stand at Tableau). We paid the 40.00 resort fee. Long wait
to check in and did not get to the pool until 3. They kicked everyone
out of the pool at 6:45. They have a no pet policy. Was traveling with a
friend and she has a support animal and they refused her at check in.
She had to find a room at another hotel last minute."
72,"It was absolutely mind blowing. The property is stunning, there is so much beauty everywhere it took over an hour to walk around the hotel and appreciate the art. There's fresh flowers everywhere, it is magnificent! The room was breathtakingly beautiful and I have never slept in a more comfortable bed. I believe the Wynn have their own brand of sheets..? The food was delicious and so refined. We will be going back there for sure."
73,The hotel and rooms are extremely nice and luxurious. The location is a little bit far from the central Las Vegas Strip.
74,Everything was amazing. The rooms were beautiful. The casinos were clean. All the food was amazing. Can't wait to come back. I won't stay anywhere else in Vegas
75,"The room was wonderful, the staff is terrific. Paying for the room is one thing, a ""resort-fee"" of $39.00 is another. All bars and restaurants are extremely expensive, even of Las Vegas Upscale properties."
76,Beautiful hotel interior.
77,"This hotel was wonderful, the bed was like a cloud, the view was spectacular, 53rd floor!! 
We had dinner at the SW Steakhouse, the vibe was beautiful and the dinner was a 10/10, I strongly recommend it!
We then went to see the show Le Reve, absolutly fantastic .
Make sure you take a swimm in their beautiful pool before you leave!"
78,"Great and clean room and bathroom, nice view, free parking, nice pools"
79,"it was an awesome experience, worth every penny paid!
The Guy that made or check in was really helpful, welcoming us with a big smile.
It is the overall attitude, but it was really pleasant to feel it.
It is a whole city, great restaurants, shopping and more that what you would need."
80,"The hotel venue, the atmosphere"
81,"The view from the room is fantastic,fast checkout and the bed is very comfort."
82,Recommended by friends & just a classy friendly hotel and made to feel like royalty
83,Panoramic room. Super comfortable bed. Amazing shower. From check in to check out it was awesome.
84,The coffe shop was magnificent
85,"Spacious room and comfortable bed, beautiful green garden/golf area, both Wynn and Encore hotel pools and amenities accessible to Wynn guests. The flower arrangements in the lobby and the buffet area are very pretty"
86,The hotel rooms are nice and casino is impressive
87,The bed is comfy and nothing to complain about it
88,"Great city view, as requested on booking.  Comfortable bed.  Great employees everywhere - all excellently trained and a credit that the hospitality profession!  Good food and bartenders in the (only) bar that serves food in the late evening - can't recall its name but very good especially the eldest guy."
89,"Our room was gorgeous - we loved the view, and the bed in particular was extremely comfy. The button by the bed that opens the curtains in the morning was a nice feature. Also, the toiletries were good quality and it was nice to have the option of a bath or shower. 
In the hotel itself, we liked that the place did not reek of smoke like other hotels in Vegas. Also, the Parasol bars were a great place for a drink with friends in the evening."
90,"The hotel feel luxurious and elegant, as it is located at the far end of The Strip."
91,The chef - Russell I think was fantastic with showing me the vegan options at the buffet.
92,Room was very nice.
93,The dinner buffet is great. Intrigue nightclub is beautiful. Do yourself a favour and get the upgrade to a room with a view!
94,By far the most up-to-date and luxury resort in Las Vegas.
95,It was actually my first time staying there and I think that the rooms the size of them were very good and was happy with that in the cleanliness and all that and the view and the encore Beach club is great also
96,"Beds were very comfortable, bathroom size was nice & shower pressure was very good ."
97,The beds are super comfy
98,Steve Wynn seems to learn from every hotel he develops and just makes the next one that little bit more special.
99,"Hotel is great....,very busy though and too much smoke in and around access to hotel room elevators."
100,The majority of the staff were courtious and helpful. The resort is kept very clean and hospitable.
101,"- Heated swimming pool
- Entertainment (DJ's at the nightclub). We had David Guetta :)
- Buffee
- interior of the hotel and the room as well 
- The luxury
- Drug dog patrol"
102,The spa and the European pool was everything.. I really enjoyed my stay and I'm thinking about coming back... really soon
103,The abundant luxury that sets The Wynn apart from all other hotels.
104,the maintenance ofthe hotel
105,"Food was great, great ambience"
106,"My wife and I loved this hotel we chose to enjoy all it offered and never left the property.  Great shows, restaurants, clubs and lounge areas.  We had a wonderful experience!"
107,"The hotel was so beautiful!!! The resturants in the hotel were pricey but worth the money,"
108,The breakfast at Tableau was awesome
109,Whole property!  Best casino.  More open and airy than most.
110,"Clean 
Quiet
Never need to wait for elevators."
111,Everything was exceptionally spectacular as expected!  I seriously kept my toiletries in my bag until I was ready to use them because the bathroom was so nice I didn't want to clutter it my personal stuff.  Didn't even want to walk around the room with my shoes on.  A rare occasion that a hotel makes me feel this way.
112,The design of the hotel and its colors are awesome. Too luxury hotel👌🏼.
113,"Had a sizeable Tower Suites room at rear of hotel with views over the golf course. Very comfortable bed, large ensuite with both bath and a large shower. Excellent informative service in the Tower Bar. Helpful staff everywhere. A first rate hotel."
114,Not a  good experience the room I paid for I did not get it and I also got  no view whatsoever I was also told I was going to get hotel credit which I didn't  receive
115,"We had a very large beautiful room with the most incredible view of the mountain range and the Strip.  The entire staff was so very nice, professional, and helpful!  We would highly recommend the Wynn hotel and we can't wait to go back there."
116,"The hotel is beautiful!
The room was decorated in a very modern style, with a lot of attention to detail. Bathroom was very big and offered shower, tub 2 sinks and a vanity. Extremely spacious and luxurious.
The hotel itself offers several excellent restaurants."
117,dining options are incredible as is room service. Also like the level of quality of casinos and gaming-- even seats at slots are covered in top of the line buttery leather.
118,"The bed was very comfortable, the room was big and very clean. It's a beautiful resort, and the Jardin restaurant was amazing."
119,"Best value/quality, Great environment, I live all year in some of the world's best hotels in Dubai and this definitely is up there top 3, also stayed in other hotels in Las Vegas, they are many levels below this one."
120,"wynn is a beautiful hotel. it's everything you hope las vegas would be about. it's chic, clean, the concierge did an excellent job helping me fill out the last bit of my itinerary for restaurants and shows that i didn't book in advance (yes, sherry, i'm thinking about you!)"
121,The Allegro Restaurant served amazing food. The show was wonderful but a little overpriced.
122,Location is excellent if you only have a few days and want to combine some shopping (right next to the big mall and high end stores) with some gambling! Casino environment is much nicer than many of the others on the strip and quality of dining options and facilities is excellent
123,"Everything ! The city, the hotel's clean facilities and the magnificent in room dining team that provided the most delicious food. The staff were fabulous. A special mention to Bri, from Registration, who checked us in. She was so thorough and smooth in her approach. Checking in was a breeze and she gave us the loveliest room on the top floor (60th) with a stunning, bejewelled view of the glittering strip. Such a panoramic view of the city as well. An extremely pleasant and friendly young lady. Cheers and thanks Bri."
124,"The room was fantastic, gym facility was great, bed comfortable, view marvelous. I particularly enjoyed watching the hot air balloons drifting over the snow capped hills in the soft light of the rising sun. Probably would have enjoyed being in the balloon more, though! Staff were friendly and helpful. The show was stunning, amazing."
125,Our family loved everything about the hotel/resort and we will definitely be coming back again!
126,"Mostly everything but gym manager
Mika, front desk manager is a very good person&
Very professional:)"
127,"Great hotel, the best in Las Vegas I would say. Facilities, rooms in Encore are new and very comfortable."
128,The room was excellent! The restaurant staff was excellent!
129,"Location,decoration,luxury,"
130,Beautiful view and the hotel is very nice
131,"It seemed cleaner than most other hotels, but the staff is a bit meaner and not so accommodating."
132,Everything was super awesome! Love their interior design that are fancy and comfortable. Room was spacious and very clean and noise level was great. Swimming pool was fantastic! They adjusted water temperature well (I stayed there during 11/10-13) and cleaned well too.
133,The attention to detail at the Wynn towers is excellent! The rooms are wonderful in the tower. The restaurants were varied and yummy. The room service was quick and hot. I love it!
134,The hotel is amazing!!!
135,Room view and ammenities are amazing. The bed was so comfortable and clean. Room has separate large bathtub in addition to a standing shower.  Elevator is very fast considering we were on floor 59. Bars inside the hotel are great as are the onsite restaurants.
136,Comfortable bed
137,"Everything! The gym, the pool and the buffet!!! I would love to watch La Reve just that my 3 yrs old is not allowed, will be back! 😊 The bed and the view!!!"
138,"We booked at a discounted price so comparing to the usual price, it was a good deal. My boyfriend and I loved the setting of the room, the bedding and the nice and big bathroom. Also, we had a great time at the casino."
139,The hotel was beautiful and set up nicely. We enjoyed eating at the SW and gaming on the casino floor. We like the newer video gaming machines and Wynn had a lot to play.
140,"Excellent, but very expensive"
141,The breakfast buffet.
142,"The view from Tower Suites is exceptional! 
The pool area is so chilled, with a nice vibe of old and new music playing. 
La Cave restaurant was superb if you want a mix of traditional and new flavours. 
The Wynn creates a calm atmosphere away from the bright casino lights and busy nightlife. 
It's was perfect location to enjoy Vegas!"
143,"The staff was extremely accommodating with all of our requests.  Food was spectacular, the entire property was immaculate, we were totally wowed."
144,"The room was beautiful; the color, the amenities, but it was the lighting options that provided us a tranquil retreat. An oversized bathtub that I indulged in, crisp Egyptian 1000 count sheets engulfed me like a fluffy cloud of silk and cotton."
145,"Luxurious hotel, beautiful room, great experience"
146,"AMAZING hotel, staff and restaurants. Best place to be! My second time here!"
147,Casino floor very nice.
148,"Very nice facilities, rooms, safe access to elevator."
149,Loved the comfortable and quiet room.  Food was excellent
150,"Good restaurants, especially the cave, tasty morsels!. Comfy bed, noise ok in strip facing room. Really nice pool."
151,"Good - Amazing building with so many details. Great views of the mountains and the strip from the 59th floor. Staff was beyond friendly - so helpful in every way.  Food in all the restaurants was excellent - flavorful and fresh.  European pool was lovely, even in October (but why, why did the  Palazzo have to blot out the last 2 golden afternoon hours worth - shaking my fist). Spa access for $40/day is totally worth it - most relaxing place to go after a whirlwind of noise and energy."
152,Good rooms
153,It was a nice atmosphere and the rooms were nice
154,"Room with a view and gadgets, pool-area and decorations in the hotel."
155,"We ate at the Allegro and both Amanda and Jack were excellent servers. Moe was most helpful when we needed help on finding information.
Le Reve show was extraordinary."
156,"Very luxurious hotel with great staff all around. The buffet is unbelievable, and is worth the cost over the week (though not sure over the weekend). Top facilities and quite nice it is right at the beginning of the strip allowing you to either be a part of the hustle and bustle or take it easy (depending on what you want)"
157,"The place, room, and staff are really amazing"
158,Location and hotel style
159,"Awesome location and the the room is spacious. Awesome city facing view and the bathroom is huge. Overall, room is comfortable and cozy and feel luxurious. Price of room is reasonable for the comfort. Hotel is beautiful with its lobby decoration, with good rating restaurants of different variety. The in-house show is also award winning and worth watching. Hotel has a huge casino and a range of in-house stores. 
Room attendant is friendly, responsive and fast in helping with issues/requests which i'm really appreciative of. Have yet to explore all amendities. Will be back again. 
Location is near both The Strip and Downtown area, making it convenient to explore Vegas."
160,"Staff was very friendly, casino was very laid back and wasn't elbo to elbo which was awesome. Our room was on the 54 floor , the room was clean and had an amazing view of the strip."
