,0
537,Amazing hotel. The attention to detail was exceptional. But the staff are fantastic and make you feel very welcome.
538,Just a great hotel. Fab rooms - lovely bath and shower - great views!
539,Highest service level.
540,Beautiful Hotel
541,All facilities restaurants concierge pool
542,The size of the room. The quality and the staff
543,"The staff were exceptional: well-trained, friendly and professional."
544,I love the view I had. Luxury
545,Location and room
546,service
547,the high quality
548,everything was great
549,"The rooms are generous and beautifully decorated.  Great views!
Loved the golf course and pool areas"
550,This was the best hotel I have ever been to. And I traveled a lot. Very recommended.
551,One of the best property in Vegas. Everything was complete in itself.
552,EVREYTHING
553,"Bed, restaurants, casino"
554,"spacious room with modern furniture, helpful staff, great casino"
555,"Would highly recommend upgrading to the Tower Suites, the views are incredible. This hotel would appeal to anyone, young or old. It's fabulous."
556,Great resort very convenient beside the resort offer anything
557,"Best hotel in Vegas. Facilities, pool and restaurants are great."
558,The Nigth clubs and The pool .
559,"Great location and amazing hotel, everything about this hotel is just GREAT."
560,"Excellent staff, great room, comfy bed. Amazing hotel what more can be said!"
561,"Great hotel and staff. The hotel was clean and   very nice. Great location, shopping and food!"
562,Very clean
563,"Comfortable room, pleasant staff"
564,The cleanliness of the room and view were amazing.
565,The bed and  the bathroom.
566,"Every thing was perfect , the best hotel ever. 
As an advice, fight for a tower room. It was an amazing experience."
567,Everything!
568,"Ambience, has the best club"
569,Everything from the check-in counter to the room to the facilities. It was wonderful.
570,The room was great
