,0
161,"Our room was fantastic, so spacious, clean and with a beautiful view. The check in/ check out process was really fast and convenient . We loved dining at lakeside ( the lobster is absolutely amazing ) , the hotel is totally worth every dollar ."
162,"Great hotel , great location , big and comfortable rooms , very nice pool area , variety of breakfasts served in few restaurants ."
163,"The foyer was spectacular, the flowers and crystal birds were stunning.  The hallway colors and decor leading to the rooms were beautiful and relaxing.  The bed was like a cloud, the shower and bath were fabulous.
The view overlooking the golf course, waterfall and mountains was inspirational.
Overall I look forward to staying again."
164,The room was gorgeous.
165,"Staff are all extremely nice and very helpful.  Food is excellent at various restaurants within the property.  Rooms are very large and comfortable.  Pool area is very nice and lots of room.  Everything is very clean and even though the hotel is located at the end of the strip, it right across the street from great shopping."
166,"I loved everything the quality is a signature all over the place.  Food is very good . Very clean and  modern . Bed is wow , view ...
Everything just everything"
167,"The location , the cleanliness , the room sizes"
168,Beautiful location. The rooms are big and spacious with beautiful views. The facilities are outstanding. The hotel has good security; it makes you feel safe and comfortable.
169,amazing pool area. great big rooms. never had a TV in the bathroom.
170,Tower room= best hotel room I've ever been in; breakfast at Tableau;
171,the room was great
172,Very comfortable room with beautiful furnishings.  Floor to ceiling windows give an amazing view of the Strip.  Access to a lot of entertainment.  Fun pool
173,The Wynn tower suite was very spacious with its own lift area and breakfast in Tableau was complimentary om my booking. Comfy beds and bed linen and nice toiletries in bathroom.
174,"Loved it! We liked everything!My husband an I had a great time, Our room was nice, clean,  and the view from our room was excellent."
175,"Beautifully set out, it felt a step above most of the other Vegas hotels. It has everything you could need and the bedroom was lovely. Floor to ceiling windows were great, with a view down the strip. The brunch is amazing (go starving!)."
176,We got a high floor room facing the Las Vegas strip. The view from the room is amazing and interior is very clean with nice decors. Colour match is very pleasant. Bathroom is highly rated with a shower space and a bathtub. Overall excellent experience. Next time we will consider getting a corner room with panoramic view!
177,"It was AWESOME.
highly recommend stay in Tower Suites.
special pool, restaurant, service, and separate registration, concierge....etc."
178,Great indoor garden! Modernized room with electronic remote controlled drapery system! Fantastic show! The Dream is definitely a Must-See in Vegas if you're a show-lover!
179,Very comfy bed and pillows; and facilities.
180,"The hotel room was very spacious, and the view of the strip was amazing! The bed was soft and cozy. The bathroom was huge! It had a shower, a huge bathtub and two sinks which was separated from  the toilet."
181,Loved the resort the amenities the pool was amazing
182,Clean facilities and helpful staff.
183,"The hotel and staff where superb. 
Fantastic service throughout our stay and the hotel is absolutely beautiful..
Best hotel in the strip."
184,Bed was comfy and room was beautiful.
185,Huge rooms
186,"Big and really nice looking rooms and bathrooms, very well equipped, nice pool area, very helpful staff, great breakfast"
187,"The view from the corner room - two window walls - was wonderful.  Hotel was beautiful.  Room was large and luxurious.  Valet parking was a godsend.  We're sorry we took so long to use it, since the self-park garage in July is like an oven."
188,"the facilities, the show, a very big room and bathroom, nice view from our room"
189,"Our room was excellent and extremely comfortable, with amazing views of the Vegas strip. The lobby area is impressive."
190,"Good facilities, range of restaurants, spacious comfortable rooms"
191,"Beautiful hotel, it is the best in vegas. Casino is perfect, beach club is amazing and the bed is very comfy"
192,"The large king deluxe room was on the 22nd floor with a strip view that was unbelievable! Huge bathroom. Clean as can be. Whoever decorated this hotel is a genius. Gorgeous details. Huge bathtub with waterfall spout, comfy bed & large closet. Great selection of restaurants, gorgeous but crowded pool area. Excellent staff. Opulent hotel."
193,Very rude staff
194,Everything!!!
195,Rooms are really nice and excellent view
196,"The rooms are pure luxury .  Bed, bathroom and view, wonderful.
Room service very good.
Check out easy.
Parking convenient."
197,This hotel is beautiful. Certainly the best on the strip. Great location. Great facilities. Gorgeous rooms.
198,Everything! Room was super clean bed was very comfortable bathroom was nice and large facility was clean at all times awesome place
199,"The restaurants are very good, particularly Costa di Mare at the Wynn and Andrea's at the adjacent resort Encore. The ""Intrigue"" nightclub is beautiful. ""Parasol Down"" bar is nice, country club jazz brunch is very good. Rooms are spacious, comfortable. Staff is friendly. Shows like ""Showstoppers"" are a must see. The decor of hotel is gorgeous with different designs made of flowers. Hotel also has luxurious boutiques like Chanel. Casino has variety of slots and table games."
200,"Splendid interior and views from the rooms. I also got a free ticket to ""The Showstoppers"" show, which was nice."
201,"There are very few things not to like about this hotel, can't think
of one right now."
202,I loved how helpful and cheerful the staff was in every way.  Even when we had a mishap with the booking agency regarding our booking dates. They helped us resolve the mishap quickly and took full responsibility and forward action to make sure we had a room for the night.  The best one at that.  The staff was so helpful and when we had some free time to scout other rooms they offered they immediately had a staff member give us a tour of the available rooms.
203,"The front desk staff were friendly
The Pool was awesome."
204,"Very comfy beds, great comfy room... Lots to do in hotel"
205,"The bed _was_ like a cloud. Location is great, clubs and other hotel facilities were great. Pool is awesome."
206,"Nice, beautiful hotel. High water pressure, nice amenities."
207,"Service and amenities are great. The buffett, the pool party at encore, the wine selection at Le Cave...all great!
The room is outstanding!"
208,Very well situated
209,"hotel amenities, environment, show, restaurants"
210,"Everything is luxury and amazing about this hotel.
Best hotel by far in Vegas, I have stayed in all 5 star hotels in Vegas and this hotel is the best so far."
211,He spent the weekend we did not get sleep Friday Saturday or Sunday due to the loud music coming from the swimming pool and also a Neighbor Next Door we called Security on for loud music and partying and an hour later they started again it kind of ruined the trip for us did love the hotel room though
212,Loved the breakfast buffet with unlimited pours!
213,"Bed was great! Overall room was neat and very comfortable. I loved the ambience at the hotel. It was very lively and with options for everyone no matter the age. I got to enjoy the pool as well, the staff was very friendly and willing to accommodate you. We had lunch at the Allegro, they have really good pizza and happy hour special! Overall a very relaxing and pleasant stay."
214,"It is like Steve Wynn said to his designers architects and building contractors ""I want every little detail of every single little piece of the building looking immaculate "" - they obeyed!"
215,The food and service at Mizumi.  Our server John helped us with his suggestions which were outstanding to make it a truly memorable meal and evening.
216,"The construction quality and cleanliness, most especially the bedroom suite was a good size and very clean"
217,"At arrival, they claimed only 1 room from Booking was reserved. We reserved 2."
218,Rooms and staff were very good
219,"Nice veiw, CHK IN manager gave us connecting rooms."
220,The room was clean and nicely decorated. marble floors very nice.
221,"We were treated with complete class. It started with being checked in by JJ, who gave us totally 5 star + treatment. Once we told him we were getting married, he upgraded our room for a slight surcharge to the top floor with a perfect and absolutely stunning view. We have stayed in the best hotels in Dubai and our experience at the Wynn surpassed our previous experiences.
We are back home now and are still talking about the room.  My wife and I were truly sad to leave and will be back to the Wynn/Encore again."
222,"size of bedrooms,chooice of restaurants,space and ambient and quiet location in close distance to center"
223,Food bars casino service all 5 star
224,"Great dining, beautiful main area"
225,"the room was amazing, the hotel is amazing, the best casino, the best hotel in contrast to other hotels we visited. Not over crowded, good location. Lake of dreams is pretty cool. New hotel and very clean"
226,Excellent service displayed by every member of staff
227,"We upgraded to the suit, it was the best thing we did...Our whole stay was incredible. 
Make sure you go and enjoy the buffet with the endless pour fizz.... Amazing"
228,"The room was upscale and beautiful. We did not splurge for the room with a view of the strip, but the view was still great. Everything was perfectly clean, staff was kind and informational, and the self parking was easy."
229,"The staff was very friendly. Robert, the concierge was particularly helpful and a wealth of knowledge. The hotel show was great."
230,"Staff very attentive.
Good location"
231,"Rooms
Swimming pool 
Show theater"
232,Facilities is good
233,Good hotel
234,swimming pool is very good
235,All is prefect
236,Excellent decor staff were extremely helpful and friendly. Rooms very clean. Excellent facilities. My favourite hotel to stay on the strip.
237,The Las Vegas strip and gambling
238,The room was excellent and so was the service.  The facility was very clean and elegant.  The view was spectacular.
239,Nice a&clean . Location
240,The location and the facility.
241,"Great hotel, with so much to offer"
242,Pool is fantastic. Staff are so nice.
243,The.hotel complete is awesome from service to amenities all great and location location location..  I would come back to this hotel for sure
244,The best hotel in Las Vegas. Top notch from top to bottom. We will definitely go back there.
245,Rooms are spacious and gorgeous. Food while expensive was great.
246,Room is beautiful
247,Standard is very high whilst some other strip properties have slipped
248,best   very good
249,Flowers in lobby
250,Everything was top notch.  Double sinks in bathroom. Huge room elegant
251,"Luxurious, clean, with great views"
252,This hotel is amazing
253,View of the city was amazing. Rooms are perfect and cleans. Best hotel in vegas
254,"The layout is convenient, lots of new games a great food choices."
255,Loved it
256,we sawb Le reve and loved it!
257,Everything
258,The high end quality of the hotel compared with others. Staff attention and hospitality. Good quality food in restaurants.
259,"Experience Tower Suites, you won't regret."
260,"3 Night club, Omnia is walking distance- Great Encore Pool Party. Beautiful View"
261,View
262,"Outstanding facility, no better place to stay."
263,Just super great
264,"Hotel is very Comfortable, Nice, safe. We got a great room with a very nice view.  Absolutely recommended"
265,The room is good
266,"Not too much, we where expecting more"
267,Everything
268,Simply the best and most elegant hotel in Las Vegas
269,Everything
270,Top Hotel - meets highest expectations
271,Gorgeous room.  Friendly staff.  Beautiful hotel and casino.
272,Great service all over the place. Good restaurants(Red the best one). Best hotel in Vegas by far.
273,You charged me more thanthe hotel site would have charged.
274,The room was clean and comfortable accept for the bed. Staff was friendly
275,"Great room (standard one was still large!), lots of facilities"
276,Evrythinh
277,"Upgraded my stay to a higher floor, got an awesome view facing the strip."
278,Great room and view!
279,Clean rooms
280,We ate at several restaurants on location and food was excellent at all places.  Atmosphere was also fun.
281,Beds were extra comfy and very spacious room.
282,"It was our 25th anniversary - they upgraded us to a suite - it was perfectly divine!
And Wynn has the best brunch hands down"
283,"Helpful and kind staff, nice pool, room cleaned twice per day"
284,Great staff and hotel very nice. Excellent buffet inside the hotel.
285,“Spetacular Hotel!!!!! .....” Fabulous Interior Decoration! .... Number 1 in Las Vegas! ...
286,Everything - the hotel was amazing
287,The staff was extremely helpful in all areas!!!!!!
288,"Privacy, 55th floor with great view, breakfast ( don't forget the reservation)"
289,The buffet was excellent
290,The bed was fantastic and room was very clean.
291,Amazing hotel wonderful views from room. Lovely comfy bed with soft bedding
292,The bathroom was very spacious.  Loved the touch control ighting. The beds were also very comfortable.
293,Very comfortable based and great interior
294,"Beautiful Hotel
Everything is perfect!"
295,"Big bed room
Buffet"
296,The whole place was really nice perfect service kind staff
297,"Beautiful facility, with incredibly attentive staff, especially at the concierge desk."
298,The fitness room was awesome
299,Best in Las Vegas!
300,Staff was very accomodative
301,"Rooms amazing, Spa"
302,Great hotel! Love it!!!
303,"location, location, location1"
304,"Staff polite and knowledge   No signs saying you could not do something
Loved the ""power"" drapes"
305,Loved the bed and comforter
306,"Cousy room, cleanses, not noise, over all the property is very nice."
307,Well maintained. Large rooms. Clean
308,"The room is clean, the facility is brand new and the decorations in lobby are beautiful."
309,Location & Luxury
310,great hotel! wonderful room ! best of the best !
311,"Great hotel, very impressive. Great room (salon suite)."
312,"Superb service, 5 stars hotel, got everything I could wish for!"
313,"Amazing hotel, rooms, facilities, cleanliness was faultless"
314,We liked everything in the hotel
315,EVERYTHING.. in my opinion this was the best hotel in Las Vegas!
316,The breakfast buffet was
317,Tutto!!!!!! Everything!!!
318,The need to more places for kids to play and witing area
319,Best hotel in Vegas
320,Luxury
321,Great service. Amazing facilities. Good sized room. Very luxurious.
322,The hospitality was incredible
323,everything
324,"Excellent customer service in every depr, bellman waitstaff,housekeeping,"
325,Excellent beautiful
326,Everything
327,"Pool area is really nice!
Flower decoration in the lobby is absolutely beautiful!!"
328,everything is good !
329,Absolutely perfect !!!
330,"Great pool area, nice big room and very good gym. Excellent breakfast as well."
331,Everything was amazing
332,Everything about the hotel is the beautiful the room are fantastic
333,THE CLEANLINESS AND FRIENDLINESS OF THE STAFF. THE WHOLE DEAL REALLY.
334,Nice
335,"Eggs benedict at the Encore
The shows: La Reve!"
336,"Beautiful hotel, great rooms with excellent services."
337,very family friendly
338,The rooms and the view amazimh
339,Rooms were spacious and luxurious
340,Location
341,"Extra comfy bed, great staff"
342,Grate value
343,Everything
344,"Cleanliness, staff the whole ambiance vey nice hotel and would definitely go back."
345,beds were so soft and deluxe
346,The vibes
347,the colors
348,we liked all hotel design and room was very comfortable.
349,We liked everything. It is a complex with all amenities needed for ypur vacations.
350,"Bellmen very fast and efficient, great housekeeping service, comfortable beds, clean hallways, everything about the Wynn this trip was perfect."
351,Everything
352,I loved the big window with the excellent view from our hotel room.
353,great breakfast buffet. and good gym.
354,The pool was awesome!
355,Best hotel in vegas
356,Bed was great. View was spectacular. All amenties first rate
357,The eggs benedict breakfast which we enjoyed in the room was amazing.
358,Cleanliness
359,Unbelievable hotel. Thoroughly enjoyed the stay. The Wynn is the best all round hotel I have ever stayed in.
360,Service was amazing. I was in shock compared to the other places i have stayed. Like a dream.
361,Fantastic hotel. Great pool. Friendly and helpful staff. Lots to do around hotel and easily accesible
362,"Bed, food,  accommodations were excellent!"
363,One of the very best resorts
364,Comfortable
365,The room was amazing!!  The lobby and interior was lovely with the colorful flowers!  LOVED our stay and will return.
366,"Excellent customer service!
Clean and well decorated room, GREAT BUFFET!"
367,Everything is perfect! My family loves this casino the best.
368,"Very accessible, quick check-in, great facilities, helpful staff but everything comes at a cost."
369,"The buffet is amazing. Hotel is more organize, quite and too busy compare to other hotels."
370,Amazing hotel
371,"First class hotel. Comfortable bed, great view."
372,Everything about the Wynn is first class! The staff is extremely professional and polite and the property itself is gorgeous!
373,"Great facilities, awesome food."
374,"Facility, the room, cleanliness, the panoramic view from 58th floor"
375,"Fantastic hotel! Great service, lovely pool and relaxed casino - a break from the chaos of the other resorts in Vegas."
376,Hotel was pretty. Mizumi sushi was very good.
377,Bed was comfy and bathroom was spacious!
378,"Luxury, loved it here! Didn't have to leave hotel!"
379,Well sized room and Great barhroom
380,"The rooms were incredible, with a wonderful view and the staff were always helpful. The encore pool party was the best one ive been to!"
381,The Wynn was one of the best hotels where I have ever stayed and I travel all the time. The room was beautiful and everything was working perfectly.
382,Bed amazing as was room - pure luxury!
383,Very beautiful hotel. The swimming pool is really nice.
384,Loved everything. Will be back
385,Just perfect
386,Wynn hotel provided ultimate luxury and sophistication.
387,Definately stay at the Wynn it is superb
388,The vieuw  at the strip. A amazing beautifull room
389,Amazing rooms - spacious and very comfortable.
390,The maid service was excellent
391,"Wonderful bathtub, gorgeous view, all restaurants were amazing!"
392,Great amazing wonderful
393,Rooms were fantastic
394,The stores
395,Beautiful property great rooms. Friendly staff.
396,👍
397,Wynn is a premier Vegas hotel.
398,Location and amenities
399,Beautiful pool area and hotel. Saw a great show John Fogerty
400,Beautiful hotel and facilities
401,Very comfortable. not a stuffy atmosphere
402,Clean
403,Food venues very good quality
404,Flowers! Also a vegan food in each restaurant! And show le reve is amazing
405,Overall our stay was very pleasant
406,buffet was awesome
407,Restaurants are Great. The place is clean and has a Nice Crowd.
408,Class of people the hotel attracts and the great attitude of the employees.
409,"perfect hotel, it worth it"
410,Nice and clean rooms
411,The costumer service there are  excellen and sweet❤
412,Bed was great. Food awesome.
413,Great hospitality!
414,The decor and the food
415,The view was amazing
416,Everything
417,"I really like the decoration of the hotel! It was very beautiful, and great experience to stay!"
418,"Great staff, hotel, location"
419,"I liked the room, the view the location"
420,"Wazuzu, The Buffet, room automation controls."
421,Overall the best hotel in Vegas.
422,Bruch
423,"Booked only one night and got complimentary upgrade to gorgeous suite, it was perfect"
424,👎🏻
425,"There facility awesome and also staff nice to us , I appreciate that."
426,Good value for money. Great food and service. Great location.
427,Still by far the best Hotel in Las Vegas
428,"Everything was so awesome,
We'll never forget that hotel"
429,It's pretty and clean. Great strip view from our room
430,Beautiful place and decor
431,Everything and everyone is awesome at this hotel...perfect
432,Always a gorgeous place to stay!
433,Happy vibes
434,I liked the layout. It was not complicated navigating around.
435,Everything was awesome
436,Comfort and personal service
437,All the food was tremendous.
438,The location and the ambience is the best on the strip
439,Every thing excellent
440,Service was excellent in all ways. Highly recommend!
441,Casino and the place
442,comfort of room
443,Variety and quality of restaurants
444,"Great location, nice room"
445,Great view from our room.
446,Very nice hotel in center of Vegas!
447,Everything
448,All was perfect
449,"Fantastic rooms, beds etc with the best ever views over the City."
450,Very comfy bed and we had a great view of the strip.
451,"Amazing hotel, amazing location - Great facilities"
452,Clean and cozy
453,I loved the hotel and the casino which was much classier than most. It was very comfortable and enjoyable. It spoiled me for other hotels.
454,"Comfortable Beds, great rooms"
455,The best hotel I've ever stayed in. Staff fantastic location brillant and hotel itself amazing. Better then the Bellagio
456,Breakfast in Tableau. The room upgrade to Tower suites.
457,"Amazing hotel, lots to do, swimming pools are just massive. The buffet has super good food. Really enjoyed our stay at the Wynn."
458,All the stuff was awesome very kind and very helpful
459,Ambiance
460,Very classy room and hotel decor was fantastic.
461,"Huge rooms, attentive staff"
462,"everything is awesome but not the check-in, it took a long time waiting(like half an hour)"
463,"Close to the fashion mall 
Very big room"
464,Everything
465,"you pay for everything, and you can get everything"
466,The vibrant decoration at Lobby and variety of brunch at the buffet.
467,"Supportive staff, great buffet and hotel environment. The department just cross the stripe and the CVS on the cross is also plus for the location."
468,The pool and view from room was amazing!
469,the bed is like a cloud. the bathroom is clean and full of function
470,The location the hotel was very clean excellent value for the money
471,Very good Hotel. Location is good
472,Beautiful
473,Size of room and automation of lights/drapes
474,Probably the best in Vegas
475,"Everything was spotless, Staff from Casino floor to Concierge were extremely polite and helpful. Loved my stay and will definitely stay again."
476,Excellent
477,"Great location, fabulous hotel over All"
478,Would have liked some more treats in the room!
479,The bathroom layout
480,Rooms were big and the hotel is a great location
481,"Great hotel, would go here again."
482,"Spacious room, lots of branded stores"
483,"Good location, nice hotel"
484,Room size
485,Love the professional staff and large room!
486,"EVERYTHING !!
CLEAN, COMFORTABLE,  STAFF HELPFUL AND VERY PRESENTABLE.  COULDN'T FAULT IT.  VIEW WAS AMAZING."
487,Nothing
488,Pool area good and large
489,everything was perdonalized...
490,Everything we could of wanted
491,The room was amazing
492,The elegance and decor
493,The bed
494,"Casino, pool , rooms and restaurants were amazing!  Went to other hotels and they no way measured up to the Wynn !"
495,"Fraud ad, rude services."
496,Overall had a good experience
497,No smoking.  Clean air inside.  Convent restaurants.  Large windows.
498,The rooms are wonderful
499,Great location at one of the best casinos
500,Location
501,The staff was friendly and helpful
502,Comfort
503,"Everything was great and I really enjoyed my staying. 
It was my second time staying at wynn"
504,swimming pool
505,Everything
506,Everything was magnificent. Definitely the best in las vegas
507,"Had and excellent stay, everything was spot on. We loved the beds."
508,Everything is amazing!!!
509,One of the top hotel
510,The room is very nice
511,Hotel was a great
512,"Great swimming pool, nice room decoration and control"
513,Everything
514,"Layout of hotel and sense of occasion.  The rooms were spacious, very well appointed and allowed us to relax!"
515,"Big suite , quite , comfortable"
516,"Design, service"
517,"The frendly treatment, the hotel environment ."
518,Perfect rooms perfect facility everything and everywhere was very clean
519,Bed was very comfortable
520,"clean spacious rooms, nice breakfast, location"
521,Excellent service
522,The room was large and had good view
523,The food and service was amazing!
524,"Location, luxury"
525,The room was beautiful
526,"The rooms, the food, everything"
527,Pool was very good. Casino was not full we can play well.
528,Spacious and luxurious rooms
529,"everything about this hotel is nice, no reason to stay anywhere else"
530,The bed is super comfy
531,"nice staff, wonderful room, great vegan options in the hotel restaurnts"
532,The room was nice and cozy. Light bright and clean.
533,Would not change a thing
534,The place is amazing love the service and very clean
535,Service at pool was outstanding
536,Excellent. Felt like a king from my room with beautiful view over the strip.
